שם,כתובת,יום,קטגוריה,הערה
גשר קארל - ב 8 בבוקר!,"Charles Bridge, Karluv most, 110 00 Praha 1, Czech Republic",יום 8,אטרקציה,מוקדם = ריק וקסום; לחפש את פסל יאן נפומוצקי
טירת פראג + קתדרלת ויטוס,"Prague Castle, Hradcany, 119 08 Praha 1, Czech Republic",יום 8,אטרקציה,גרסת טעימות: חצרות + קתדרלה מבחוץ + תצפית
פוניקולר פטרשין,"Petrin funicular, Ujezd, 118 00 Praha 1, Czech Republic",יום 8,אטרקציה,רכבל לגבעה: מגדל תצפית + מבוך מראות
הרובע היהודי + אלטנוישול,"Old New Synagogue, Cervena 2, 110 00 Praha 1, Czech Republic",יום 8,ערב,בית הכנסת של הגולם; בית הקברות העתיק; ליד המסעדות הכשרות
אצטדיון ספרטה פראג (אופציה: משחק 1-2.8),"epet ARENA, Milady Horakove 98, 170 00 Praha 7, Czech Republic",יום 8,ערב,"ספרטה נגד זלין נופל בסופ""ש שלכם; מועד מדויק וכרטיסים רק ב-sparta.cz"
